{
  "$schema": "../../schemas/interop-vector-v1.schema.json",
  "schema_version": 1,
  "contract": "plenora-interop-vector-v1",
  "kind": "rejection",
  "description": "data.run rejects wkb-truncated with the category of its class (REJ-001).",
  "input": "../arrow-data-v1/invalid-wkb-truncated.json",
  "chain": [
    {
      "component": "plenora-data-tools",
      "operation": "data.run",
      "version": 2,
      "params": {
        "plan": "geo.centroid"
      },
      "transformations": []
    }
  ],
  "expected_error": {
    "class": "input",
    "category": "data_mapping",
    "phases": [
      "read"
    ],
    "remote_effects": [
      "none"
    ],
    "retry": "never",
    "exit_code": 3,
    "rules": [
      "GEO-011",
      "REJ-001"
    ]
  }
}
