{
  "$schema": "../../schemas/interop-vector-v1.schema.json",
  "schema_version": 1,
  "contract": "plenora-interop-vector-v1",
  "kind": "rejection",
  "description": "Two geometry fields and a truncated value: the support limit comes before the values (REJ-002).",
  "input": "../arrow-data-v1/invalid-two-geometries-and-truncated.json",
  "chain": [
    {
      "component": "plenora-io-tools",
      "operation": "io.write",
      "version": 2,
      "params": {
        "format": "gpkg",
        "limits": [
          "one_geometry_field"
        ]
      },
      "transformations": []
    }
  ],
  "expected_error": {
    "class": "support",
    "category": "unsupported",
    "phases": [
      "validate"
    ],
    "remote_effects": [
      "none"
    ],
    "retry": "never",
    "exit_code": 3,
    "rules": [
      "GEO-012",
      "REJ-002"
    ]
  }
}
