{
  "$schema": "../../schemas/interop-vector-v1.schema.json",
  "schema_version": 1,
  "contract": "plenora-interop-vector-v1",
  "kind": "rejection",
  "description": "data.run rejects contract-version-absent with the category of its class (ARROW-013).",
  "input": "../arrow-data-v1/invalid-contract-version-absent.json",
  "chain": [
    {
      "component": "plenora-data-tools",
      "operation": "data.run",
      "version": 2,
      "params": {
        "plan": "identity"
      },
      "transformations": []
    }
  ],
  "expected_error": {
    "class": "input",
    "category": "schema",
    "phases": [
      "validate"
    ],
    "remote_effects": [
      "none"
    ],
    "retry": "never",
    "exit_code": 3,
    "rules": [
      "ARROW-001",
      "ARROW-013"
    ]
  }
}
